{
  "schema_version": "admit-record.v0",
  "record_id": "rec_acme_attn_prefill_015",
  "prev_hash": "sha256:87930123062e3573ae3c9fa5f8662e25981b9b140ddc27a5eb158969f8dfa66d",
  "created_at": "2026-11-03T06:40:11Z",
  "commentary": "Faster on two microbench shapes; serving parity failed. Do not serve. Keep last_good.",
  "region": {
    "region_id": "attn.prefill.qkv",
    "graph_hash": "sha256:bbcd57f9162e8a42bbf26df28a6b2a3ac2f8793061c036e198afeaf4f65d6db0",
    "op_family": "attention"
  },
  "pins": {
    "hw_id": "nvidia.b200.80gb",
    "compiler_ver": "triton==3.3.0+cu128",
    "adapter_id": "triton.v0",
    "model_id": "vendor.frontier.2026-10-20",
    "policy_id": "lintel.specialize.v0"
  },
  "actions": [
    {
      "kind": "propose_schedule",
      "enum_id": "triton.attn.num_warps=16.block_m=64"
    }
  ],
  "cache_key": {
    "schema_version": "cache-key.v0",
    "graph_hash": "sha256:bbcd57f9162e8a42bbf26df28a6b2a3ac2f8793061c036e198afeaf4f65d6db0",
    "hw_id": "nvidia.b200.80gb",
    "compiler_ver": "triton==3.3.0+cu128",
    "adapter_id": "triton.v0",
    "policy_id": "lintel.specialize.v0"
  },
  "cache_key_digest": "sha256:ec25e38a28d690828ecd63234173704d013c7062aa3e919ba5d31765831c35d7",
  "oracles": [
    {
      "name": "golden",
      "version": "0.1.0",
      "result": "pass",
      "false_neg_owner": "kernels@acme"
    },
    {
      "name": "numerical",
      "version": "0.1.0",
      "result": "pass",
      "false_neg_owner": "kernels@acme",
      "detail": "max_abs_err<1e-3 on shape_grid.attn.prefill.v3"
    },
    {
      "name": "serving_ab",
      "version": "0.1.0",
      "result": "fail",
      "false_neg_owner": "serving@acme",
      "detail": "output_parity=0 on 3/1000 decode samples; tokens_per_s +11% on kernel bench (ignored)"
    }
  ],
  "artifact": {
    "digest": "sha256:0e0ecbefe475d49eb85f80e704642376a3e52371d08ca370cd0071d9736290f9",
    "kind": "triton_kernel",
    "uri": "git://acme/serving-kernels.git@last_good / kernels/attn_prefill_qkv.py"
  },
  "fitness": {
    "F_name": "serving.tokens_per_s * quality_parity",
    "baseline": 1.0,
    "delta": 0.0,
    "usd_per_compile": 41.0,
    "traces": ["acme.prod.decode.2026-10.sample"]
  },
  "decision": "fallback",
  "fallback": "last_good"
}
